<?xml version="1.0" encoding="UTF-8"?>
<!DOCTYPE tvlist SYSTEM "tvlist.dtd">
<tvlist>
    <cd></cd>
    <title>Tv Listings</title>
    <programe>Movie</programe>
    <chanal>CBS</chanal>
    <name>Darken Dill</name>
    <time>10:30PM</time>
    <month>june</month>
    <year>2017</year>
    <news>English AT: 10:00 PM</news>
    <search>Listing</search>
    
</tvlist>

